HUMAN_H3N2_14_16,1317,HUMAN H3N2 STRAINS FROM FLU SEASONS 14-15 AND 15-16 DOWNLOADED IN 01/2017
HUMAN_H3N2_14_15,761,HUMAN H3N2 STRAINS FROM FLU SEASON 14-15 DOWNLOADED IN 01/2017
HUMAN_H3N2_15_16,558,HUMAN H2N2 STRAINS FROM FLY SEASON 15-16 DOWNLOADED IN 01/2017
HUMAN_H1N1_12_17,1246,HUMAN H1N1 STRAINS FROM FLU SEASONS 12-13, 13-14, 14-15, 15-16 AND 16-17
HUMAN_H1N1_15_16,856,HUMAN H1N1 STRAINS FROM FLU SEASON 15-16
HUMAN_ALL,9716,ALL AVAILABLE (UNIQUE) HUMAN INFLUENZA A STRAINS IN FLUDB DOWNLOADED IN 10/2016
SWINE_H3N2_ALL,794,ALL AVAILABLE (UNIQUE) SWINE H3N2 STRAINS IN FLUDB DOWNLOADED IN 01/2017
SWINE_H1N1_ALL,1096,ALL AVAILABLE (UNIQUE) SWINE H1N1 STRAINS IN FLUDB DOWNLOADED IN 01/2017
AVIAN_H5,1463,ALL AVAILABLE (UNIQUE) AVIAN H5 STRAINS IN FLUDB DOWNLOADED IN 01/2017